{
  "$schema": "../../../../schemas/battle-enemy.schema.json",
  "id": "enemy_orc_shaman",
  "label": "呪文詠みのオーク",
  "flavorText": "聖人としての社会的地位を確立している。",
  "sprite": "battle_orc_shaman",
  "stats": {
    "hp": 7200,
    "str": 720,
    "def": 1220,
    "int": 1700,
    "ref": 1460,
    "agi": 840,
    "hitRate": 0.92,
    "evadeRate": 0,
    "critRate": 0.05,
    "critDamageMultiplier": 1.5
  },
  "traits": [
    "trait_weak_physical"
  ],
  "activeSkills": [
    "skill_weird_wave",
    "skill_curse_bolt"
  ],
  "passiveSkills": [],
  "actionPattern": [
    "skill_weird_wave",
    "skill_curse_bolt",
    "skill_curse_bolt"
  ],
  "isBoss": false
}
