{
  "$schema": "../../../../schemas/battle-enemy.schema.json",
  "id": "enemy_knight",
  "label": "没落の騎士",
  "flavorText": "かの帝国は、とうの昔に滅びた。",
  "sprite": "battle_knight",
  "stats": {
    "hp": 12820,
    "str": 1700,
    "def": 3410,
    "int": 720,
    "ref": 1700,
    "agi": 960,
    "hitRate": 0.93,
    "evadeRate": 0,
    "critRate": 0.05,
    "critDamageMultiplier": 1.5
  },
  "traits": [
    "trait_resist_physical"
  ],
  "activeSkills": [
    {
      "id": "skill_strike",
      "level": 2
    },
    "skill_guard_shield"
  ],
  "passiveSkills": [],
  "actionPattern": [
    "skill_strike",
    "skill_guard_shield",
    "skill_strike"
  ],
  "isBoss": false
}
